{
  "$schema": "https://json-schema.org/draft/2020-12/schema",
  "$id": "https://contracts.shopflow.test/order/v3",
  "title": "Order (v3)",
  "description": "Order v3 = v2 + settlement_currency + fx_rate_ppm. Writer chỉ ghi v3 khi order quy đổi tiền tệ; còn lại ghi v2 (order.schema.json).",
  "x-contract-version": 3,
  "type": "object",
  "additionalProperties": false,
  "required": ["contract_version", "order_id", "account_id", "account_tier", "currency", "settlement_currency", "fx_rate_ppm", "items"],
  "properties": {
    "contract_version": { "const": 3 },
    "order_id": { "type": "string", "minLength": 1 },
    "account_id": { "type": "string", "minLength": 1, "description": "Id của account trong Account API." },
    "account_tier": { "enum": ["standard", "gold", "vip"] },
    "currency": { "type": "string", "pattern": "^[A-Z]{3}$" },
    "settlement_currency": { "type": "string", "pattern": "^[A-Z]{3}$", "description": "Tiền tệ ghi sổ (ledger) của order." },
    "fx_rate_ppm": { "type": "integer", "minimum": 1, "maximum": 1000000000, "description": "Số đơn vị settlement_currency cho 1 đơn vị currency, nhân 1 000 000. Bằng 1000000 khi settlement_currency = currency." },
    "items": {
      "type": "array",
      "minItems": 1,
      "items": {
        "type": "object",
        "additionalProperties": false,
        "required": ["sku", "qty", "unit_price"],
        "properties": {
          "sku": { "type": "string", "minLength": 1 },
          "qty": { "type": "integer", "minimum": 1 },
          "unit_price": { "type": "integer", "minimum": 0 }
        }
      }
    }
  }
}
